"source_id"|"ticid"|"toi"|"targetid"|"iscdipstarget"|"reference"|"name"|"age"|"nbhd_rating"|"init_priority"|"current_priority"|"pending_spectroscopic_observations"|"pending_photometry_observations"|"comment"|"rp"|"rp_unc"|"period"|"gaia_ra"|"gaia_dec"|"gaia_plx"|"gaia_Gmag"|"gaia_Bmag"|"gaia_Rmag"|"tic_Bmag"|"tic_Vmag"|"tic_Jmag"|"tic_Hmag"|"tic_Kmag"|"tic_Tmag"|"tic_teff"|"tic_logg"|"tic_rstar"|"tic_mstar"|"candidate_provenance"|"insert_time"|"last_update_time"|"isretired"|"disposition"|"rot_quality"|"Prot"|"vsini"|"rot_amp"|"sig_Prot"|"Tdur"|"sig_Tdur"|"Mp_pred"|"K_orb"|"K_RM"|"K_orb/sig_Prot"|"K_RM/sig_Tdur"
"5561614350584396800"|"29786532"|"--"|"29786532.01"|1|"CantatGaudin_2018,CantatGaudin_2019_velaOB2,Zari_2018_PMS,CantatGaudin_2018,CantatGaudin_2019_velaOB2,Zari_2018_PMS"|"Collinder_135,cg19velaOB2_pop4,N/A,Collinder_135,cg19velaOB2_pop4,N/A"|"--"|"0.0"|"0.00"|"2.00"|"SP2, Not a planet (young M dwarf secondary). Propose for TripleSpec (4.1, on the SOAR), under the science case of young M dwarf stellar modeling, rather than planets."|"--"|"LCOGT (1 OIBEO 20200114 showed on target) M-dwarf + HJ/BD/M dwarf. 40 Myr old, Gaia membership is strong. 2.5Rjup radius is standard (see Burrows+2001 cooling track). TESS photometry shows rstar rotation is decoupled from orbital period. Need mass measurement to characterize system -- worth spending some time on. Nbhd analysis shows RA/dec a few deg from Collinder135 center. RV not available. PM good. Plx good. CMD good (pre-MS). Ground based phot implies it’s like M3+M6 dwarf. Transit too deep (Rp~=39Re), even given the age. The age and radius imply it's a low-mass stellar companion, with Mstar~0.2Msun if Burrows' models are to be believed. "|"41.51"|"12.45"|"1.59"|"109.98"|"-40.23"|"3.14"|"15.62"|"16.91"|"14.47"|"17.06"|"16.58"|"12.85"|"12.17"|"11.96"|"14.53"|3645|"4.31"|"0.85"|"0.53"|"20191110_followup_comment_strings"|"2020-01-09 13:58:49.097943"|"2020-01-09 13:58:49.097988"|0|"EB,CM,MM_binary"|"--"|"--"|"--"|"--"|"--"|"--"|"--"|"--"|"--"|"--"|"--"|"--"
"5596735638203997824"|"154671430"|"--"|"154671430.01"|1|"Kounkel_2019,CantatGaudin_2018"|"NGC_2527,NGC_2527"|"8.91,8.82"|"1.0"|"0.00"|"0.00"|"SP0 (But V=13.4). HOLD - depth increase vs ap size is janky enough, and price is high enough, that it might be worth prioritizing other objects. Else Go for 3 PFS RVs (or maybe CHIRON?) to assess prospect for mass measurement."|"hold off unless 2mmag precision seems achievable. Ready for RVs!"|"Need blend analysis. Priority for RVs. LCOGT(4 useable from  20191215 & 20191217 & 20191224 & 20191229-- consistent, with shallow signals, but not particularly helpful b/c 0.2% dip). Possible super-Neptune, P=1.1 d orbit. CDIPS report centroid analysis not great b/c of crowdedness ...LCO  ground-based photometry (0.2% dip) did help rule out <40” NEB blends though. Nbhd analysis shows in RA/dec it's relatively far from cluster core (2-3 sigma). Plx, PM look great. CMD shows it's a little bit (1-2 sigma) faint. RA/dec space looks like ~2-3 sigma away from cluster center. CG18 Pmemb=90%. CHIRON(1 recon spectrum in fiber mode) shows star RV is consistent with Gaia cluster RV. Li is strong (as expected for Teff=6270K). 2019-11-26, RV 38.348 0.039 Teff 6236 logg 4.32 feh 0.17 vsini 12.0. Shows a ""nice broad Li line"".  vsini of 12km/s for a Teff=6270K star with Rstar between 1.14Rsun (TIC8) and ~1.3Rsun (Mamajek)implies Prot of ~4.5-5 days, consistent w/ Curtis’ gyro sequences of ~600Myr-1Gyr, and inconsistent with the Prot=10days seen in the field."|"5.90"|"0.45"|"1.16"|"122.31"|"-29.55"|"1.47"|"13.22"|"13.50"|"12.78"|"13.87"|"13.36"|"12.28"|"12.03"|"12.01"|"12.84"|6274|"4.41"|"1.14"|"1.22"|"20191110_followup_comment_strings"|"2020-01-09 13:58:49.469328"|"2020-01-09 13:58:49.469361"|0|"PC"|"--"|"--"|"--"|"--"|"--"|"--"|"--"|"--"|"--"|"--"|"--"|"--"
"5599752663752776192"|"110718787"|"--"|"110718787.01"|1|"CantatGaudin_2018"|"Haffner_13"|"7.52"|"0.0"|"0.00"|"2.00"|"--"|"--"|"LCOGT(2, egresses). HATS (many G602/3, showed event seems to be off-target). Cand HJ around ~30 Myr star, strong rot variability.  Membership seems pretty good (CG18), but RV to verify couldn't hurt. Centriod looks good, but medium-crowded -- ground-based transit followup also needed. Nbhd analysis shows PMs maybe 1 sigma off. Plx good, position fine, CMD good."|"22.67"|"6.80"|"3.09"|"114.73"|"-29.39"|"1.78"|"14.53"|"15.03"|"13.89"|"15.55"|"14.90"|"13.07"|"12.62"|"12.53"|"13.95"|5090|"4.51"|"0.85"|"0.85"|"20191110_followup_comment_strings"|"2020-01-09 13:58:49.850348"|"2020-01-09 13:58:49.850381"|1|"NEB"|"--"|"--"|"--"|"--"|"--"|"--"|"--"|"--"|"--"|"--"|"--"|"--"
"5618515825371166464"|"456787081"|"--"|"456787081.01"|1|"Kharchenko2013"|"ASCC_39"|"8.71"|"1.0"|"1.00"|"2.00"|"--"|"--"|"20191209: LGB retiring due to unconvincing existence of cluster (as visible in neighborhood plots). Cand HJ about K dwarf in ASCC 39. CG18 didnt recover this cluster (raises doubts about existence). Nor did Conrad+17. Cluster would need to be better characterized for strong claims to proceed. Nbhd analysis suggests cluster is maybe coherent in PM and parallax space... but even if it is, the star's membership in the cluster is tenuous. Can follow-up, would be hard to publish."|"-1.00"|"-1.00"|"-1.00"|"113.28"|"-22.86"|"0.83"|"15.97"|"16.45"|"15.34"|"17.22"|"16.17"|"14.63"|"14.15"|"14.10"|"15.39"|5339|"4.52"|"0.87"|"0.92"|"20191110_followup_comment_strings"|"2020-01-09 13:58:50.217936"|"2020-01-09 13:58:50.217983"|1|"notcdips,NonCM"|"--"|"--"|"--"|"--"|"--"|"--"|"--"|"--"|"--"|"--"|"--"|"--"
"5715454237977779968"|"349118653"|"--"|"349118653.01"|1|"CantatGaudin_2018"|"NGC_2421"|"7.45"|"0.0"|"1.00"|"2.00"|"--"|"--"|"Phil Evans ruled out 21 ppt event on target, confirmed 200 ppt NEB on neighbor 7"" East (w/ a 3"" aperture). --> It's a NEB. LCOGT(2, 1 ambig, other ?).  Cand ultra-HJ on 16hr orbit around evolving(?) star in a ~40 Myr old cluster, at ~2kpc. Either (a) stellar EB, given dip size, or (b) inflated/still contracting giant planet / BD. Probably (a), but this one is worth checking. Nbhd analysis shows PMs good, parallax good, CMD is slightly turning off, position fine (maybe 1 sigma from center)."|"44.77"|"13.43"|"0.76"|"114.19"|"-20.50"|"0.35"|"14.24"|"14.54"|"13.78"|"14.83"|"14.35"|"13.16"|"13.02"|"12.89"|"13.86"|7680|"3.79"|"2.84"|"1.80"|"20191110_followup_comment_strings"|"2020-01-09 13:58:50.575440"|"2020-01-09 13:58:50.575473"|1|"NEB"|"--"|"--"|"--"|"--"|"--"|"--"|"--"|"--"|"--"|"--"|"--"|"--"
"5240531632175135616"|"467522800"|"--"|"467522800.01"|1|"Kounkel_2019,Zari_2018_PMS,Kounkel_2019,Zari_2018_PMS"|"IC_2602,--,IC_2602,--"|"8.34,7.55"|"-1"|"0.33"|"2.00"|"SP2 dips show chromaticity"|"--"|"LCOGT(3, 20200131 and 20200204 ip, 20200208 gp). ip vs gp shows strong chromaticity. Initially possible HJ in IC2602; but it's an EB. 2x TLS period."|"20.68"|"1.94"|"1.06"|"168.75"|"-64.35"|"7.25"|"15.33"|"17.04"|"14.07"|"18.36"|"16.54"|"12.24"|"11.65"|"11.37"|"13.98"|3198|"4.74"|"0.49"|"0.49"|"CDIPS_followup_tracker_20200109_import_s8-s11"|"2020-01-09 13:58:50.994717"|"2020-01-09 13:58:50.994750"|1|"EB,CM,MM_binary"|"--"|"--"|"--"|"--"|"--"|"--"|"--"|"--"|"--"|"--"|"--"|"--"
"5246508676134913024"|"269861070"|"--"|"269861070.01"|1|"Zari_2018_PMS"|"--"|"--"|"-1"|"0.33"|"2.00"|"SP2 (V=13). SB2. Triple-lined recon spectrum from CHIRON. Unlikely to ever yield mass without very dedicated campaign."|"--"|"LGB retiring 20200308 as on-target EB (PMS K dwarf) due to odd-even persistence after better detrending. Odd-even affected by spot detrending. Cand HJ, PMS K dwarf (Zari+18). Multisector (S9-S11). Nice Prot~=4.0days, ~3% amplitude. Roughly 2x planet period. That’s sub-Pleiades gyro age. 1 transit window obsd by MEarth South (J Irwin) out of window because of bad ephemeris. 1 by Don Radford (Briarfield0.36m). "|"13.18"|"5.14"|"1.97"|"148.44"|"-64.79"|"4.23"|"12.82"|"13.51"|"12.03"|"14.35"|"13.09"|"10.94"|"10.34"|"10.18"|"12.08"|4457|"4.17"|"1.14"|"0.70"|"CDIPS_followup_tracker_20200109_import_s8-s11"|"2020-01-09 13:58:51.411290"|"2020-01-09 13:58:51.411323"|1|"EB,CM,KM_binary"|"--"|"--"|"--"|"--"|"--"|"--"|"--"|"--"|"--"|"--"|"--"|"--"
"5251740294225360128"|"378421253"|"--"|"378421253.01"|1|"Kounkel_2019,CantatGaudin_2018,GaiaCollaboration2018_tab1a"|"IC_2602,IC_2602,IC2602"|"8.34,7.55"|"-1"|"0.67"|"2.00"|"--"|"--"|"20200119: LGB retiring as PC because extra manual detrending showed its a Mdwarf persistent dipper (shape not at all planetary). Cand super-Neptune; IC2602 (30Myr; CG18). PMS M dwarf. Faint."|"8.19"|"0.34"|"0.75"|"155.38"|"-63.74"|"6.64"|"15.99"|"17.66"|"14.74"|"-1.00"|"-1.00"|"12.97"|"12.34"|"12.10"|"14.65"|3220|"4.82"|"0.41"|"0.40"|"CDIPS_followup_tracker_20200109_import_s8-s11"|"2020-01-09 13:58:51.812648"|"2020-01-09 13:58:51.812683"|1|"dipper,CM"|"--"|"--"|"--"|"--"|"--"|"--"|"--"|"--"|"--"|"--"|"--"|"--"
"5252320149182351744"|"460024410"|"--"|"460024410.01"|1|"Kounkel_2019"|"kc19group_1172"|"8.96"|"-1"|"0.33"|"0.33"|"SP2 (no chance)."|"--"|"Cand HJ; Theia 1172 (KC19). Cluster existence very questionable."|"13.38"|"4.01"|"2.12"|"156.19"|"-62.13"|"1.14"|"13.69"|"14.01"|"13.18"|"14.35"|"13.79"|"12.60"|"12.36"|"12.26"|"13.26"|6730|"4.37"|"1.30"|"1.43"|"CDIPS_followup_tracker_20200109_import_s8-s11"|"2020-01-09 13:58:52.211578"|"2020-01-09 13:58:52.211609"|0|"PC,pNonCM"|"--"|"--"|"--"|"--"|"--"|"--"|"--"|"--"|"--"|"--"|"--"|"--"
"5254794943702272640"|"459997997"|"--"|"459997997.01"|1|"Kounkel_2019"|"kc19group_1141"|"8.94"|"-1"|"0.33"|"2.00"|"SP2 NEB"|"--"|"NEB (Phil Collins, 2020.03.09, in Ic). This is a bright field star, TIC8 Teff=8500K. CHIRON recon claims Teff=6000K. Retiring from further CDIPS followup, but worth DT verification (P=5.5d, V=10.5).  2020-02-04T08-55-03.8 2458883.8790700003 RV -1.798 0.573 Teff 5940 logg 2.99 feh -0.16 vsini 48.2. Cand WJ, Theia 1141 (KC19). Group existence is weak. (Possibly T=10.5 field star). Hot and bright enough to enable doppler tomography, so worth pursuing regardless."|"15.51"|"0.81"|"5.55"|"156.25"|"-60.58"|"1.89"|"10.66"|"10.81"|"10.42"|"10.85"|"10.52"|"10.12"|"10.01"|"10.05"|"10.47"|8511|"4.15"|"2.04"|"2.12"|"CDIPS_followup_tracker_20200109_import_s8-s11"|"2020-01-09 13:58:52.591356"|"2020-01-09 13:58:52.591389"|1|"NEB,notcdips"|"--"|"--"|"--"|"--"|"--"|"--"|"--"|"--"|"--"|"--"|"--"|"--"
"5255504399239636992"|"463903016"|"--"|"463903016.01"|1|"Kounkel_2019"|"kc19group_908"|"8.79"|"-1"|"0.33"|"0.33"|"SP2"|"--"|"Cand HJ, Theia 908 (500Myr; KC19). Crowded+faint; neighbor spot signal."|"11.31"|"2.10"|"1.44"|"154.90"|"-58.90"|"3.80"|"17.07"|"18.34"|"15.89"|"-1.00"|"18.15"|"14.32"|"13.74"|"13.69"|"15.83"|3455|"4.86"|"0.36"|"0.35"|"CDIPS_followup_tracker_20200109_import_s8-s11"|"2020-01-09 13:58:52.942359"|"2020-01-09 13:58:52.942393"|0|"PC,pNonCM"|"--"|"--"|"--"|"--"|"--"|"--"|"--"|"--"|"--"|"--"|"--"|"--"
"5256502966294604800"|"853388144"|"--"|"853388144.01"|1|"CantatGaudin_2018"|"NGC_3114"|"8.3"|"-1"|"0.33"|"2.00"|"SP2"|"--"|"LCOGT(1, 20200203, showed is NEB). Cand HJ; NGC 3114 (300Myr; CG18). Check for NEB."|"33.53"|"10.06"|"1.65"|"151.25"|"-60.30"|"0.93"|"15.71"|"16.17"|"15.03"|"-1.00"|"15.95"|"-1.00"|"-1.00"|"-1.00"|"15.12"|5750|"4.57"|"0.87"|"1.03"|"CDIPS_followup_tracker_20200109_import_s8-s11"|"2020-01-09 13:58:53.325063"|"2020-01-09 13:58:53.325096"|1|"NEB"|"--"|"--"|"--"|"--"|"--"|"--"|"--"|"--"|"--"|"--"|"--"|"--"
"5256717749007641344"|"462162963"|"--"|"462162963.01"|1|"CantatGaudin_2018"|"NGC_3114"|"8.3"|"-1"|"0.50"|"0.50"|"SP1. Get 1 CHIRON recon spectrum to check vsini, Doppler tomography prospects, and cluster membership"|"10 OIBEO gp sched. multisector fixed."|"LCOGT(2, 20200116 OIBEO, showed most likely on-target. 20200204 OIBE showed dip, but 30 nbhrs within 2’ show similar variability. 20200208 and 20200212 gp showed maybe same depth, but still could be NEB.). Near TOI 684 (but different), very hot star. HJ, NGC 3114 (~150Myr, CG18). Multisector. CHIRON(1) yields vsini~=50km/s, no further spec FU needed unless we decide this is worth a shot for DT. But with Bp =12.6, perhaps a bit faint for it.  2020-02-08T08-03-09.1 2458887.84865 RV -0.629 0.911 Teff 7116 logg 3.93 feh 0.24 vsini 48.0. Maybe if more phot FU shows no chromaticity?"|"23.84"|"7.72"|"1.35"|"150.37"|"-59.85"|"0.97"|"12.50"|"12.62"|"12.28"|"12.64"|"12.43"|"12.03"|"11.98"|"11.98"|"12.39"|14466|"-1.00"|"-1.00"|"-1.00"|"CDIPS_followup_tracker_20200109_import_s8-s11"|"2020-01-09 13:58:53.729671"|"2020-01-09 13:58:53.729718"|0|"PC"|"--"|"--"|"--"|"--"|"--"|"--"|"--"|"--"|"--"|"--"|"--"|"--"
"5290968085934209152"|"410450228"|"681"|"681.01"|1|"GaiaCollaboration2018_tab1b,Kounkel_2019,CantatGaudin_2018,Zari_2018_UMS,GaiaCollaboration2018_tab1b,Kounkel_2019,CantatGaudin_2018,Zari_2018_UMS"|"NGC2516,NGC_2516,NGC_2516,--,NGC2516,NGC_2516,NGC_2516,--"|"8.48,8.4"|"-1"|"0.67"|"2.00"|"--"|"--"|"TOI 681 in NGC 2516 (broad catalog agreement). SG2 lists as Chile-MPIA (4 Coralie, 4 FEROS, looks like a 70 MJ BD). The period is 15 days. At 300 Myr, valuable benchmark! Any NGC 2516 analysis should mention. Rafael Brahm & the Chile-MPIA team are following -- no further RVs needed. It’s ready for writing up (maybe with a few more RVs)"|"13.08"|"4.24"|"15.78"|"117.89"|"-60.41"|"2.34"|"10.91"|"11.07"|"10.64"|"11.36"|"10.88"|"10.33"|"10.21"|"10.16"|"10.68"|7296|"4.20"|"1.69"|"1.65"|"CDIPS_followup_tracker_20200109_import_s8-s11"|"2020-01-09 13:58:54.123300"|"2020-01-09 13:58:54.123331"|1|"BD,CM,F_BD_binary"|"--"|"--"|"--"|"--"|"--"|"--"|"--"|"--"|"--"|"--"|"--"|"--"
"5304507540851982592"|"46029346"|"--"|"46029346.01"|1|"Kounkel_2019"|"kc19group_163"|"7.89"|"-1"|"0.11"|"2.00"|"SP2 (V=12.4, deep, shows RV variations indicative of SB1 binary)."|"--"|"20200226, LGB retiring as EB due to large RV variations (24km/s) indicative of a binary anti-phased with the transit ephemeris (CHIRON-Zhou, 2). LCOGT (1, 20200127, well out of transit b/c of imprecise ephemeris. Try again w/ updateephem. 20200214 ip, 20200224 gp combined do not show chromaticity. Phil Evans 20200220 in Rc 45-50ppt.). Cand HJ, Theia 163 member (60 Myr; KC19). Deep transit. Multisector. Prot ~ 1.5 days, compared to ~1.4 for orbital period. But definitely different. Rot amplitude of 7-8%. Good group for Jason and Luke to work on, but stars do seem very coeval vs the nbhd, strongly suggesting group is real. Careful inspection of CDIPS raw LCs shows secondary eclipse, though not necessarily game-ending."|"25.45"|"12.08"|"1.38"|"131.83"|"-57.19"|"2.75"|"12.21"|"12.55"|"11.73"|"12.94"|"12.42"|"11.19"|"10.92"|"10.80"|"11.78"|6089|"4.41"|"1.10"|"1.14"|"CDIPS_followup_tracker_20200109_import_s8-s11"|"2020-01-09 13:58:54.516676"|"2020-01-09 13:58:54.516708"|1|"EB,CM"|"--"|"--"|"--"|"--"|"--"|"--"|"--"|"--"|"--"|"--"|"--"|"--"
"5308445029440522112"|"444222135"|"--"|"444222135.01"|1|"Kounkel_2019"|"kc19group_1242"|"9.1"|"-1"|"0.33"|"0.33"|"SP2 (no chance)."|"--"|"Cand HJ, Theia 1242. Tdur long + maybe TTV?. Cluster maybe nonexistent."|"16.93"|"1.51"|"3.04"|"147.34"|"-54.16"|"1.56"|"12.93"|"13.21"|"12.49"|"13.58"|"13.16"|"11.95"|"11.67"|"11.65"|"12.55"|6298|"4.35"|"1.24"|"1.24"|"CDIPS_followup_tracker_20200109_import_s8-s11"|"2020-01-09 13:58:54.899600"|"2020-01-09 13:58:54.899636"|0|"PC,pNonCM"|"--"|"--"|"--"|"--"|"--"|"--"|"--"|"--"|"--"|"--"|"--"|"--"
"5309192628626779648"|"432564189"|"--"|"432564189.01"|1|"CantatGaudin_2018"|"Ruprecht_82"|"8.37"|"-1"|"0.67"|"2.00"|"--"|"--"|"20200118, LGB retiring as EB. Cand HJ (maybe EB). Ruprecht 82 (230Myr; CG18, d=2kpc). Prop motion weakly suspicious. Even if it is 230Myr old, Rp of >3Rjup is highly questionable."|"39.02"|"11.71"|"3.76"|"146.52"|"-53.98"|"0.46"|"13.98"|"14.24"|"13.55"|"14.44"|"14.07"|"12.98"|"12.75"|"12.70"|"13.62"|7116|"3.89"|"2.35"|"1.58"|"CDIPS_followup_tracker_20200109_import_s8-s11"|"2020-01-09 13:58:55.271403"|"2020-01-09 13:58:55.271433"|1|"EB"|"--"|"--"|"--"|"--"|"--"|"--"|"--"|"--"|"--"|"--"|"--"|"--"
"5312011948237411456"|"298077526"|"--"|"298077526.01"|1|"Kounkel_2019"|"kc19group_1242"|"9.1"|"-1"|"0.33"|"0.33"|"SP2"|"--"|"Cand HJ, Theia 1242. Cluster maybe nonexistent. Hot star."|"9.74"|"0.63"|"1.92"|"142.71"|"-53.85"|"1.39"|"12.35"|"12.66"|"11.88"|"13.07"|"12.44"|"11.31"|"11.13"|"11.01"|"11.97"|8100|"4.20"|"1.84"|"1.97"|"CDIPS_followup_tracker_20200109_import_s8-s11"|"2020-01-09 13:58:55.654726"|"2020-01-09 13:58:55.654757"|0|"PC,pNonCM"|"--"|"--"|"--"|"--"|"--"|"--"|"--"|"--"|"--"|"--"|"--"|"--"
"5312141072137904512"|"859480036"|"--"|"859480036.01"|1|"Kounkel_2019,CantatGaudin_2018"|"NGC_2925,NGC_2925"|"7.8,8.04"|"-1"|"0.17"|"2.00"|"SP2, it's a double-lined binary."|"--"|"Retired 20200210 as double-lined EB. Cand HJ, NGC 2925 (100Myr; CG18; KC19). Photometric binary likely (wouldnt be subgiant because its before turnoff). Multisector. pmDEC is off, by 0.5 mas/yr. This could be done with a projected onsky orbital velocity of 1.8km/s, which equating to the semiamplitude would give msini of 15Mjup. CDIPS LC has hints of phase modulation in S9 and S10. Teff=7000K, so “precise” mass measurement not a question. But we only need 100m/s precision. 1 CHIRON recon spectrum shows double lined; it's an EB. "|"27.40"|"9.87"|"2.60"|"143.15"|"-53.43"|"1.28"|"12.89"|"13.18"|"12.44"|"-1.00"|"13.01"|"-1.00"|"-1.00"|"-1.00"|"12.51"|7070|"4.27"|"1.52"|"1.56"|"CDIPS_followup_tracker_20200109_import_s8-s11"|"2020-01-09 13:58:56.058791"|"2020-01-09 13:58:56.058825"|1|"pEB,SB2"|"--"|"--"|"--"|"--"|"--"|"--"|"--"|"--"|"--"|"--"|"--"|"--"
"5321581959996214016"|"93275779"|"--"|"93275779.01"|1|"CantatGaudin_2018,GaiaCollaboration2018_tab1a,Kounkel_2019"|"IC_2391,IC2391,IC_2391"|"8.05,7.67"|"-1"|"0.33"|"0.33"|"SP2"|"--"|"Cand super-Neptune, IC2391 (~80Myr; CG18). PMS M dwarf; faint. Tdur is long (like 2x too long given supposed host star). Schedule 2m ip followup. Seems somewhat likely to be persistent dipper."|"6.28"|"1.22"|"0.91"|"129.94"|"-52.32"|"6.65"|"16.31"|"17.95"|"15.05"|"19.15"|"-1.00"|"13.24"|"12.64"|"12.38"|"14.96"|3232|"4.85"|"0.37"|"0.36"|"CDIPS_followup_tracker_20200109_import_s8-s11"|"2020-01-09 13:58:56.460087"|"2020-01-09 13:58:56.460122"|0|"dipper"|"--"|"--"|"--"|"--"|"--"|"--"|"--"|"--"|"--"|"--"|"--"|"--"
"5322083917107299712"|"92896631"|"--"|"92896631.01"|1|"CantatGaudin_2019_velaOB2"|"cg19velaOB2_pop2"|"--"|"-1"|"0.17"|"2.00"|"SP2, recon spectrum showed composite, likely SB2."|"4 OIBEO pre 20200330. 3 OIBE on the same timescale. multisector fixed."|"Retiring as SB2, b/c CHIRON is showing composite spectrum between two rapidly rotating stars. Depth is suspicious too. Cand WJ, Vela OB2 pop2 (<50Myr CG19). If its so young, wouldn’t the star be more active?"|"36.53"|"9.62"|"5.64"|"129.25"|"-50.39"|"2.50"|"11.34"|"11.68"|"10.86"|"12.06"|"11.47"|"10.32"|"9.99"|"9.93"|"10.92"|6712|"4.11"|"1.75"|"1.43"|"CDIPS_followup_tracker_20200109_import_s8-s11"|"2020-01-09 13:58:56.836938"|"2020-01-09 13:58:56.836983"|1|"EB,SB2"|"--"|"--"|"--"|"--"|"--"|"--"|"--"|"--"|"--"|"--"|"--"|"--"
"5329853517263005696"|"260119000"|"--"|"260119000.01"|1|"CantatGaudin_2019_velaOB2"|"cg19velaOB2_pop4"|"--"|"-1"|"0.33"|"2.00"|"--"|"--"|"Retired 20200204 as NEB/possible field HJ. Cand HJ, Vela OB2 pop4 (20Myr CG19). LCOGT(1, 20200202, showed it’s not on target. There is a flat-bottomed transit on TIC260118987, a 10” neighbor, = Gaia 5329853517263007360. However this neigbhor which likely hosts the dip seems to be somewhat evolved, and is not on the target list. Phil Evans saw the same, off-target, roughly simultaneously). Centroid unclear. If it’s really that young, it should show spots. Likely spurious membership? It’s in the dispersed portion of NGC2541B/pop4. Check for Li. "|"12.34"|"3.70"|"2.94"|"130.96"|"-46.25"|"2.38"|"14.13"|"14.67"|"13.46"|"15.05"|"14.43"|"12.64"|"12.16"|"12.06"|"13.50"|5695|"4.66"|"0.78"|"1.01"|"CDIPS_followup_tracker_20200109_import_s8-s11"|"2020-01-09 13:58:57.229560"|"2020-01-09 13:58:57.229590"|1|"NEB"|"--"|"--"|"--"|"--"|"--"|"--"|"--"|"--"|"--"|"--"|"--"|"--"
"5338645555866749952"|"306385801"|"--"|"306385801.01"|1|"Kounkel_2019,Dias2014,GaiaCollaboration2018_tab1b,CantatGaudin_2018,Kharchenko2013,Zari_2018_UMS,Kounkel_2019,Dias2014,GaiaCollaboration2018_tab1b,CantatGaudin_2018,Kharchenko2013,Zari_2018_UMS"|"NGC_3532,NGC 3532,NGC3532,NGC_3532,NGC_3532,--,NGC_3532,NGC 3532,NGC3532,NGC_3532,NGC_3532,--"|"8.65,8.55"|"-1"|"0.33"|"2.00"|"SP2 (was SP0 before recon showed EB)."|"2 OIBEO, 1 OIBE, 1 IBEO, 7 OIB, 4 BEO before 20200530. multisector fixed"|"LCOGT(1, OIBE, 20200211, nice on-target ingress, confirm 7 day, not 14!). Nice WJ, NGC 3532 (300Myr;many authors). P=7d or P=14d from TESS. 4 transits over S10&S11. Good DT target. Evans observed odd ingress in Rc 20200225, confirmed on-target and 7 day. Retiring as P=7day EB in NGC 3532. Presumably A+M dwarf. 3 CHIRON spectra showed extremely narrow lines, indicative of tidal synchronization by a high mass companion. Also showed RV variability over these 3 epochs at 20km/s."|"22.73"|"0.79"|"7.02"|"166.66"|"-58.86"|"2.05"|"9.51"|"9.54"|"9.50"|"6.08"|"9.84"|"9.49"|"9.48"|"9.44"|"9.53"|10120|"4.19"|"2.16"|"2.60"|"CDIPS_followup_tracker_20200109_import_s8-s11"|"2020-01-09 13:58:57.601875"|"2020-01-09 13:58:57.601907"|1|"EB,CM,AM_binary"|"--"|"--"|"--"|"--"|"--"|"--"|"--"|"--"|"--"|"--"|"--"|"--"
"5339389268061191040"|"308425348"|"--"|"308425348.01"|1|"CantatGaudin_2018,GaiaCollaboration2018_tab1b,Kounkel_2019"|"NGC_3532,NGC3532,NGC_3532"|"8.65,8.55"|"-1"|"0.67"|"2.00"|"SP2"|"--"|"Cand super-Neptune; NGC 3532; initially flagged as “maybe false alarm” but it seems clearly in LC. Need LC with ~mmag precision (depth 2 mmag). Reasonably crowded – might be on a neighbor star. CHIRON recon gives broad lines, 2020-02-03T08-00-08.2 2458882.8414 RV 7.053 0.062 Teff 6254 logg 4.22 feh 0.03 vsini 20.6. RV agrees with Gaia dn cluster mean. So does vsini. Need the phot followup. LCOGT 20200215 OIBEO ip challenging reduction, but maybe saw egress.  CHIRON(2) shows RVs show 2km/s variations in phase with the transit ephemeris. Perhaps misclassified, and it's a BD (or blended EB) and not a 6Re planet.  LGB will schedule 2 additional CHIRON slicer/fiber observations, as appropriate. 3 CHIRON RVs show a 2km/s variation, perhas indicating a BD or stellar companion. Closer inspection of vetting report shows it’s probably offtarget."|"5.87"|"1.88"|"3.40"|"167.58"|"-58.98"|"2.07"|"12.68"|"12.98"|"12.23"|"13.30"|"12.73"|"11.69"|"11.50"|"11.41"|"12.29"|6271|"4.45"|"1.09"|"1.22"|"CDIPS_followup_tracker_20200109_import_s8-s11"|"2020-01-09 13:58:57.992422"|"2020-01-09 13:58:57.992454"|1|"offtarget,pBD"|"--"|"--"|"--"|"--"|"--"|"--"|"--"|"--"|"--"|"--"|"--"|"--"
"5404579488593432576"|"135036669"|"--"|"135036669.01"|1|"Kounkel_2019"|"IC_2602"|"8.34,7.55"|"-1"|"0.33"|"0.33"|"SP2. Put it on the TripleSpec proposal."|"--"|"Cand super-Neptune; IC2602 (30Myr; KC19). PMS M dwarf. Faint. Tdur is long (2.4hr vs 0.8hr predicted). Suspect it’s another Mdwarf persistent dipper. The shape is a bit weird. d=130pc, they don’t get much better! But Rp=15.6, T=15.7"|"7.31"|"0.32"|"0.91"|"150.27"|"-52.44"|"7.58"|"17.20"|"19.25"|"15.84"|"20.47"|"-1.00"|"13.77"|"13.22"|"12.91"|"15.71"|2999|"4.95"|"0.27"|"0.25"|"CDIPS_followup_tracker_20200109_import_s8-s11"|"2020-01-09 13:58:58.372668"|"2020-01-09 13:58:58.372704"|0|"dipper,pPC"|"--"|"--"|"--"|"--"|"--"|"--"|"--"|"--"|"--"|"--"|"--"|"--"
"5405530566146401408"|"432925586"|"--"|"432925586.01"|1|"Zari_2018_PMS"|"--"|"--"|"-1"|"0.67"|"0.67"|"SP2. It’s faint. Put it on TripleSpec proposal."|"--"|"Cand HJ; PMS M dwraf (Zari+18). No stellar rotn (worrying). Check spectra for activity."|"17.66"|"0.84"|"2.02"|"146.98"|"-52.01"|"2.03"|"16.78"|"18.08"|"15.65"|"19.84"|"17.84"|"14.13"|"13.46"|"13.25"|"15.60"|3469|"4.61"|"0.65"|"0.62"|"CDIPS_followup_tracker_20200109_import_s8-s11"|"2020-01-09 13:58:58.740140"|"2020-01-09 13:58:58.740177"|0|"PC,pNonCM"|"--"|"--"|"--"|"--"|"--"|"--"|"--"|"--"|"--"|"--"|"--"|"--"
"5406188928778889472"|"133323306"|"--"|"133323306.01"|1|"Kounkel_2019"|"kc19group_988"|"8.75"|"-1"|"0.50"|"0.50"|"SP2"|"--"|"Cand 1.1d HJ, Theia 988 (~500Myr; KC19). Short period rotn(?) signal too. Multisector. Porb=1.094968, Prot=0.264554. No harmonic. “Rotation” looks more like contact EB though. Strongly suspect group is not real – the HR diagram is garbage. "|"12.55"|"0.85"|"1.10"|"149.57"|"-49.94"|"1.06"|"12.29"|"12.52"|"11.90"|"12.87"|"12.42"|"11.43"|"11.29"|"11.20"|"11.97"|7330|"3.99"|"2.16"|"1.66"|"CDIPS_followup_tracker_20200109_import_s8-s11"|"2020-01-09 13:58:59.114543"|"2020-01-09 13:58:59.114578"|0|"PC,pNonCM"|"--"|"--"|"--"|"--"|"--"|"--"|"--"|"--"|"--"|"--"|"--"|"--"
