"source_id"|"ticid"|"toi"|"targetid"|"iscdipstarget"|"reference"|"name"|"age"|"nbhd_rating"|"init_priority"|"current_priority"|"pending_spectroscopic_observations"|"pending_photometry_observations"|"comment"|"rp"|"rp_unc"|"period"|"gaia_ra"|"gaia_dec"|"gaia_plx"|"gaia_Gmag"|"gaia_Bmag"|"gaia_Rmag"|"tic_Bmag"|"tic_Vmag"|"tic_Jmag"|"tic_Hmag"|"tic_Kmag"|"tic_Tmag"|"tic_teff"|"tic_logg"|"tic_rstar"|"tic_mstar"|"candidate_provenance"|"insert_time"|"last_update_time"|"isretired"|"disposition"|"rot_quality"|"Prot"|"vsini"|"rot_amp"|"sig_Prot"|"Tdur"|"sig_Tdur"|"Mp_pred"|"K_orb"|"K_RM"|"K_orb/sig_Prot"|"K_RM/sig_Tdur"
"4827527233363019776"|"77951245"|"450"|"450.01"|1|"Gagne_2018_BANYAN_XIII"|"COL"|"--"|"--"|"1.00"|"2.00"|"--"|"--"|"(THYME) TOI-450, Columba association. Tokovinin already acquired speckle images.  Being pursued by E. Newton & team for RV cluster membership confirmation. Proprietary HARPS specturm in F. Bouchy's hands. SALT/HRS (2), Gemini/IGRINS (2020A)        SALT/HRS, Gemini/IGRINS, THYME Collaboration (Tofflemire). Ziegler did contrast curve. --> IS EB (ANDREW MANN, PRIV COMM.)"|"34.69"|"14.09"|"10.71"|"79.01"|"-31.41"|"18.66"|"13.80"|"15.57"|"12.53"|"16.67"|"15.64"|"10.63"|"10.14"|"9.79"|"12.43"|3160|"4.81"|"0.42"|"0.42"|"20191110_followup_comment_strings"|"2020-01-09 13:58:42.405258"|"2020-01-09 13:58:42.405289"|1|"EB"|"--"|"--"|"--"|"--"|"--"|"--"|"--"|"--"|"--"|"--"|"--"|"--"
"4844691297067063424"|"257605131"|"451"|"451.01"|0|"Curtis_2019,E_Newton"|"PscEri"|"7.2"|"--"|"0.00"|"0.00"|"SP0 (V=10.9, Rp=4.0, period=16d, leadership questionable given THYME claim)."|"--"|"TOI-451, Psc-Eri. Zhou/Quinn's CHIRON spectrum shows Li absorption. Ziegler did contrast curve. Has total of THREE PCs on ExoFOPTESS. Spectrum shows vsini=9km/s --> Prot = 5, not 2.5days. WASP shows 4.5day rot period, full amplitude 2%. Verified by SG1. Rodriguez perhaps pursuing mass measurements w/ PFS (but 9km/s means 90m/s jitter expected. Hard to get the masses. If multi, can just validate a la V1298 Tau. T=10, so perhaps worthwhile. DV report indicates multi system seems plausible.)."|"3.95"|"0.69"|"8.19"|"63.00"|"-37.90"|"-1.00"|"10.75"|"-1.00"|"-1.00"|"11.64"|"10.94"|"9.64"|"9.29"|"9.19"|"10.27"|5481|"4.56"|"0.86"|"0.96"|"20191110_followup_comment_strings"|"2020-01-09 13:58:42.800787"|"2020-01-09 13:58:42.800821"|0|"PC,pMulti"|0|"4.50"|"9.67"|"0.0200"|"193.38"|"4.44"|"7.94"|"15.60"|"5.09"|"12.24"|"0.03"|"1.54"
"5519619186857962112"|"81419525"|"580"|"580.01"|1|"CantatGaudin_2018,Kounkel_2019,CantatGaudin_2019_velaOB2,Zari_2018_UMS,CantatGaudin_2018,Kounkel_2019,CantatGaudin_2019_velaOB2,Zari_2018_UMS"|"Pozzo_1,Vela_OB2,cg19velaOB2_pop7,N/A,Pozzo_1,Vela_OB2,cg19velaOB2_pop7,N/A"|"7.08"|"0.0"|"0.00"|"1.00"|"SP1 (V=9.5). Get 1 CHIRON recon spectrum, assess SpType and Doppler tomography prospect. (Mass measurement highly unlikely)"|"--"|"LCOGT(1, non-detection b/c bad epoch; 1 OIBEO 20191216 reduced, but ruined by clouds, 20200213 showed ingress in 25px*0.39as/px=9.75as aperture, quite defocused). ""3 GAIA stars within 5"" SG1 finds tentative detection in aperture including target and two nearby stars."". SG2 flags as CPC-. Nbhd analysis shows parallax good, pm both viable. Pretty dispersed cluster (few deg) and far from core in ra/dec... and star is on UMS. Needs spectroscopy. Ziegler did contrast -curve. Updated SG1 results say PNEB (possible NEB, but need another epoch to see, however “Next SG1 observation finds event to be more likely on the pair of stars 5"" away.”). With infinite time, would get more phot, in focus (i.e., manual tuned LCOGT). However given likelihood of NEB, not scheduling further in 20A."|"11.77"|"1.79"|"1.55"|"123.11"|"-46.11"|"2.86"|"9.58"|"9.64"|"9.50"|"9.68"|"9.54"|"9.40"|"9.38"|"9.33"|"9.55"|11159|"4.51"|"1.58"|"2.92"|"20191110_followup_comment_strings"|"2020-01-09 13:58:43.152784"|"2020-01-09 13:58:43.152818"|0|"PC,PNEB"|"--"|"--"|"--"|"--"|"--"|"--"|"--"|"--"|"--"|"--"|"--"|"--"
"5525188767305211904"|"180987952"|"581"|"581.01"|1|"CantatGaudin_2018,Zari_2018_UMS,CantatGaudin_2019_velaOB2,CantatGaudin_2018,Zari_2018_UMS,CantatGaudin_2019_velaOB2"|"Trumpler_10,N/A,cg19velaOB2_pop2,Trumpler_10,N/A,cg19velaOB2_pop2"|"--"|"0.0"|"0.00"|"0.00"|"SP1. (V=9.5). Got CHIRON recon, no more needed. If phot confirms on target, can validate from Rp alone (mass measurement unlikely). Age of few tens of Myr, so worthwhile."|"LCOGT 10 OIBEO pre 20190315"|"LCOGT (1, non-detection b/c bad epoch, 1 OIBEO 20200101 showing dip on target.). ""SG1 clears many stars of NEB, but a handful of potential contami--ts remain. Will try again."" SG1 flags as PPC. Parallax good, PM probably within like 1 sigma of cluster PM dispersion. Spatially also medium distance from core (not too far, not too close). Ziegler did contrast curve. Rp=4.7Re. P=1.4d. d=400pc. (Eastman). Rstar=1.7Rsun, Teff~=11000K. Sector8+9 data are available. LC might show extra PCs? CHIRON(1) shows vsini>200km/s, too rapidly rotating to do more spectroscopy with."|"5.48"|"0.34"|"1.39"|"130.26"|"-41.44"|"2.28"|"9.48"|"9.49"|"9.50"|"9.45"|"9.48"|"9.46"|"9.47"|"9.47"|"9.53"|10585|"4.35"|"1.84"|"2.74"|"20191110_followup_comment_strings"|"2020-01-09 13:58:43.530607"|"2020-01-09 13:58:43.530638"|0|"PC"|"--"|"--"|"--"|"--"|"--"|"--"|"--"|"--"|"--"|"--"|"--"|"--"
"5251470948229949568"|"460205581"|"837"|"837.01"|1|"Kharchenko2013,Kounkel_2019,CantatGaudin_2018,GaiaCollaboration2018_tab1a"|"IC_2602,IC_2602,IC_2602,IC2602"|"8.34,7.55"|"1.0"|"1.00"|"0.00"|"SP0. Brahm has FEROS. GO for Veloce at ~10m/s precision (**no need to get down to 1m/s**).   Predicted K_planet=90m/s, P_orb=8.3d, K_spot=300m/s, P_rot=3.5d."|"LCOGT 7 partials pre 20190301. Schedule more after!"|"LCOGT (2, 1 bad epoch, 1 OIB 20200117 that did not show clear transit signal. ). FEROS (4, Rafael Brahm). Has Li. LC shows strong rot signal (2% amplitude). Multisector available (S10+S11, CDIPS, missed b/c TFA over-detrended). SG1 flagged as single transit -- but now it's NOT (P=8days). Despite Gaia & CG18 membership, nbhd analysis shows parallax is nearly 0.25mas larger than typical in cluster -- possibility of foreground star (star isn't particularly bright/blue, no offset argument). PMs are good. Positions are decent. RV is good. P=8d, Rp=8Re. vsini=17km/s observed from FEROS. single-lined early-G/late-F type star. Li EW is consistent with a young star (more so than a typical field Teff=6100K G dwarf). Ziegler did contrast curve, compnaion (deltaI=4.5) at ~2.1 arcsec introduces NEB blend scenario. Gaia DR2 info of the companion strongly suggests it's bound (same PMs and parallax). There's also a DeltaT=3 star at 5 arcsec, possible blend. CHIRON RV gamma of 16km/s + Li confirms membership (which was good but not definitive from kinematics). CHIRON RV RMS < 1km/s. Go for Veloce, and more phot followup. No more CHIRON needed"|"8.24"|"1.43"|"8.32"|"157.04"|"-64.51"|"6.99"|"10.36"|"10.70"|"9.89"|"11.12"|"10.63"|"9.39"|"9.11"|"8.93"|"9.93"|6104|"4.49"|"1.01"|"1.15"|"20191110_followup_comment_strings"|"2020-01-09 13:58:43.893116"|"2020-01-09 13:58:43.893149"|0|"PC"|"spec"|"3.01"|"17.00"|"0.0200"|"340.00"|"1.77"|"8.37"|"49.60"|"14.26"|"67.92"|"0.04"|"8.12"
"5290721997195236480"|"372913430"|"861"|"861.01"|1|"CantatGaudin_2018,Kounkel_2019,Zari_2018_UMS,CantatGaudin_2018,Kounkel_2019,Zari_2018_UMS"|"NGC_2516,NGC_2516,--,NGC_2516,NGC_2516,--"|"8.48,8.4"|"0.0"|"0.00"|"2.00"|"SP1 (V=8.3), get 1 CHIRON recon spectrum to check RV, assess Doppler tomography prospects. Worth mentioning in a NGC 2516 homogeneous study."|"LCOGT 5 OIBEO/4stage pre 20190301"|"""Crowded field"". TIC 372913430. 0.5% dip, P=13.5 days warm jupiter, Teff=9100K. RA/dec in center of cluster, parallax good as well. PMs are 2mas/yr from PM of cluster center. Given the position & parallax, likely not an issue – maybe caused by companion. (RV might clarify). Ziegler got speckle AO, rules out binary companion to ~0.2-0.3 arcsec. Ascribing the offset to companion implies 3km/s orbital velocity, and 60Mjup companion… (Seems likely to be EB in this case!). “QLP reanalysis suggests an NEB (dpeth-aperture correlation)”. SG2 retires as NEB."|"24.48"|"8.00"|"13.48"|"119.53"|"-60.78"|"2.34"|"8.36"|"8.41"|"8.30"|"8.31"|"8.30"|"8.21"|"8.20"|"8.23"|"8.35"|10341|"3.80"|"3.39"|"2.66"|"20191110_followup_comment_strings"|"2020-01-09 13:58:44.281304"|"2020-01-09 13:58:44.281339"|1|"NEB"|"--"|"--"|"--"|"--"|"--"|"--"|"--"|"--"|"--"|"--"|"--"|"--"
"5576476552334683520"|"148479278"|"520"|"520.01"|1|"Kounkel_2019,Zari_2018_UMS,Kounkel_2019,Zari_2018_UMS"|"Platais_5,--,Platais_5,--"|"7.78,7.53"|"1.0"|"0.00"|"0.00"|"SP2"|"--"|"SG1 clears field of NEBs, though crowded. vsini=120km/s (CHIRON, Zhou); NRES fast rotator too. Rp=2.0Re, P=0.52d (Eastman). PM of ~10mas/yr in each dirn, d=200pc. NB. Platais 5 moving group is young enough that the KC19 HR diagram shows the PMS for the M dwarfs -- the HRD is awesome. The velocity string is also clear. (CG18 did not report Platais 5, but not surprising b/c of how sparse it is). Nbhd analysis from K13 ""members"" suggestive but not convincing. FROM K13: ----Plx vs pmdec shows an overdensity, suggesting the group is real. The CMD looks decent. RA/dec not at all convincing. (But note KC19 maybe better for this one...)----- FROM KC19: The neighborhood assessment looks pretty convincing. The RV for this star is where it should be. Two big clumps, PM is right on. Quinn got 2 RVs w/ CHIRON. Ziegler did contrast curve, rules out binary companion to within dM=5 at 1arcsec (~200AU b/c d=200pc), similar down to ~50AU. Given the depth, can probably validate."|"1.81"|"1.66"|"0.52"|"102.66"|"-37.96"|"4.47"|"9.62"|"9.81"|"9.34"|"10.02"|"9.73"|"9.04"|"8.91"|"8.85"|"9.38"|7323|"4.29"|"1.53"|"1.66"|"20191110_followup_comment_strings"|"2020-01-09 13:58:44.643127"|"2020-01-09 13:58:44.643162"|0|"PC"|"--"|"--"|"--"|"--"|"--"|"--"|"--"|"--"|"--"|"--"|"--"|"--"
"5557593814516968960"|"130415266"|"588"|"588.01"|1|"Kounkel_2019,Zari_2018_UMS,Kounkel_2019,Zari_2018_UMS"|"AB_Dor,--,AB_Dor,--"|"8.03"|"1.0"|"0.00"|"0.00"|"SP1 (V=7.3), get 1 CHIRON recon spectrum for stellar params and RV for membership."|"--"|"""Period is double or four times larger; T0=1481"". P~40day. TIC 130415266. Two transits viewed... ! Teff~9600K, T=7.6. Tricky to schedule (for transit followup). HD 52470. Nothing on the HARPS archive. An RV to place it in the strong AB Dor RV stream (or not) would be helpful. In v_l vs longitude (mw2d plot), clearly apparent stream. In the nbhd plots, it's not obvious (but maybe this is a projection problem?) Ziegler did contrast curve. Ephemeris too imprecise for phot followup, uncertainty is 0.5 days"|"12.11"|"2.70"|"40.00"|"104.75"|"-47.02"|"6.46"|"7.26"|"7.27"|"7.30"|"7.26"|"7.28"|"7.25"|"7.33"|"7.28"|"7.31"|10416|"4.35"|"1.82"|"2.69"|"20191110_followup_comment_strings"|"2020-01-09 13:58:44.993813"|"2020-01-09 13:58:44.993844"|0|"PC,lostephem"|"--"|"--"|"--"|"--"|"--"|"--"|"--"|"--"|"--"|"--"|"--"|"--"
"5579734916388215808"|"772008799"|"1014"|"1014.01"|1|"Kounkel_2019,Zari_2018_UMS,Kounkel_2019,Zari_2018_UMS"|"Platais_5,--,Platais_5,--"|"7.78,7.53"|"1.0"|"0.00"|"0.00"|"SP2, though SQ 1 CHIRON pending. RV might confirm membership, but it’s a A1-IV subgiant. No chance at mass."|"Need with a <1m telescope(?), though 2mmag is hard. No good comparison stars."|"LCOGT (1, 20191224. 10 mmag precision, no chance for a 3 mmag transit. Not enough comparison stars – was experimental at 2 sec exposure. Result of experiment was: for LCO 1m, bright limit is like V=8.5). ""Might be diluted; SG1 to check"". From K13 members, not at all convincing. From KC19 members, PM and parallax plausible for it being a member of the stream. NEED AN RV TO CHECK. And spectra to determine youth. NB. independently found this one from CDIPS in Sector 6 -- threw it out b/c was ""just ZariUMS PC"". But the dips look weirdly close to being in phase w/ some kind of stellar pulsation mode (only every ~4 or 6 oscillations?!). Ziegler got speckle AO, shows binary companion at 2.11arcsec, deltaI=1.3mag. Note TOI 1014 == TIC 96246348 on exoFOP-TESS but this is wrong, it’s TIC 772008799. Note also TOI 1014 == CCDM J06542-3413AB, a known binary (spectroscopic? How?). Primary is a subgiant, SpType A1IV. From TIC8 it seems there are at least 3 relevant stars in the TESS aperture. However one might be double-counted, in which case it’s just the AB binary."|"-1.00"|"-1.00"|"-1.00"|"103.56"|"-34.22"|"4.42"|"7.58"|"7.52"|"7.59"|"-1.00"|"7.60"|"-1.00"|"-1.00"|"-1.00"|"7.68"|-1|"-1.00"|"-1.00"|"-1.00"|"20191110_followup_comment_strings"|"2020-01-09 13:58:45.359691"|"2020-01-09 13:58:45.359739"|0|"PC"|"--"|"--"|"--"|"--"|"--"|"--"|"--"|"--"|"--"|"--"|"--"|"--"
"5325454783543157760"|"400595342"|"1034"|"1034.01"|1|"Kounkel_2019,Zari_2018_UMS,Kounkel_2019,Zari_2018_UMS"|"kc19group_237,--,kc19group_237,--"|"7.9"|"1.0"|"1.00"|"1.00"|"SP2"|"--"|"LCOGT (1, no detection, but consistent w/ shallow depth). ""need SG1 to check 400595381; likely BEB"". Group is somewhat weak. A bit too old for PMS to be super-convincing (but maybe other indicators possible). Star membership in group from nbhd plot looks pretty good. (Though the group membership is not much stronger). Not convincing enough to lead."|"3.96"|"1.00"|"3.64"|"134.44"|"-49.00"|"2.72"|"9.88"|"9.97"|"9.77"|"10.07"|"9.88"|"9.60"|"9.57"|"9.53"|"9.82"|9810|"4.43"|"1.61"|"2.51"|"20191110_followup_comment_strings"|"2020-01-09 13:58:45.714335"|"2020-01-09 13:58:45.714365"|0|"PC,pNonCM"|"--"|"--"|"--"|"--"|"--"|"--"|"--"|"--"|"--"|"--"|"--"|"--"
"5838450865699668736"|"360630575"|"1097"|"1097.01"|1|"Kounkel_2019"|"kc19group_64"|"7.42"|"1.0"|"0.00"|"0.00"|"SP0. SQ 2 CHIRON pending. Need 1 CHIRON recon spectrum. Should see strong Li. Then need 3 RVs to assess mass measurement prospects (Rp=2.5Re, spot amplitude could be larger than planet signal). Validation paper is worthwhile if mass measurement will require many seasons."|"LCOGT 1 total, 2 OIBE/IBEO, 2 OIB/BEO pre 20190301"|"LCOGT (20200209, BEO, too high scatter to detect 500ppm transit). ""bright potential L1 candidate"". QLP shows ~0.5-1% strong rotational variability (as-in, strong young star). The PMS of the group looks good. Star has plx of ~12.5mas, compared to group mean of ~9.8 pm 1mas. Nbhd analysis shows the group is definitely real. Like it's a freakin whopper. Young enough that spectra (Li, Halpha,..) will clarify youth. Worth pursuing. Mann weakly suggests a secondary eclipse. Manual inspection of QLP LC does show some additional dips, but not obviously secondary eclipses. Not S11+S12 TESS data are available. Too low SNR in S11 CDIPS LC (b/c small and P=9days). Should check if eleanor S11+S12 give dips."|"2.35"|"0.12"|"9.19"|"189.78"|"-74.57"|"12.54"|"9.14"|"9.47"|"8.68"|"9.94"|"9.29"|"8.14"|"7.89"|"7.82"|"8.72"|5876|"4.48"|"0.98"|"1.06"|"20191110_followup_comment_strings"|"2020-01-09 13:58:46.062502"|"2020-01-09 13:58:46.062533"|0|"PC"|0|"6.50"|"7.63"|"0.0150"|"114.42"|"2.34"|"1.72"|"6.00"|"1.76"|"2.63"|"0.02"|"1.53"
"2919143383943171200"|"53682439"|"--"|"53682439.01"|1|"Zari_2018_PMS"|"--"|"--"|"--"|"1.00"|"1.00"|"SP1, low priority for 1 PFS recon spectrum (look for Halpha). No CHIRON necessary, or possible. TripleSpec proposal possible."|"8 OIBEO gp pre 20200315. After getting one, stop."|"LCOGT(1 IBEO ambiguous; 1 OIBEO i-band good). Many HATS(good). Possible PMS dwarf with close-in giant planet (else EB). ~4% amplitude spot signal. T~=15 and red, so maybe best for a NIR spectrograph?. From LCO2m, have Rp/Rstar=0.24894. Plausible Rp, but the duration is a tad long (implies too low density). My hesitation about this object is that it's faint (T=15, V=17), and that the case for youth isn't amazing. We need AO images to argue against a triple-star system explanation, I think. Maybe Speckle-AO with Zorro on Gemini could do it, but I doubt smaller telescopes could.  I think we would also need to see Halpha emission in a recon spectrum to believe more strongly in the case for youth.  Try for gp band, get 1 recon spectrum w/ PFS (if 30 minutes possible… 1 hour a bit long). "|"19.47"|"5.84"|"0.64"|"103.31"|"-27.18"|"2.02"|"16.34"|"17.48"|"15.27"|"18.53"|"17.22"|"13.83"|"13.20"|"12.89"|"15.34"|3725|"4.38"|"0.80"|"0.56"|"20191110_followup_comment_strings"|"2020-01-09 13:58:46.445909"|"2020-01-09 13:58:46.445940"|0|"PC,pNonCM"|"--"|"--"|"--"|"--"|"--"|"--"|"--"|"--"|"--"|"--"|"--"|"--"
"3050033749239975552"|"125192758"|"--"|"125192758.01"|1|"CantatGaudin_2018"|"NGC_2323"|"8.26"|"0.0"|"0.00"|"2.00"|"--"|"--"|"KeplerCam photometry (Allyson Bieryla) shows it's a NEB. Was labelled Giant PC in M50, ~100Myr star with rotational variability. CHIRON (2, Zhou), showed star has double-peaked CCF, large RV variation. RV=24km/s and RV=128 km/s measured. Livingston got a contrast curve too."|"29.25"|"8.77"|"1.73"|"105.39"|"-8.82"|"0.88"|"14.73"|"15.22"|"14.09"|"15.17"|"15.11"|"13.31"|"12.84"|"12.77"|"14.15"|5384|"4.06"|"1.49"|"0.93"|"20191110_followup_comment_strings"|"2020-01-09 13:58:46.818988"|"2020-01-09 13:58:46.819024"|1|"NEB"|"--"|"--"|"--"|"--"|"--"|"--"|"--"|"--"|"--"|"--"|"--"|"--"
"3340674976430098688"|"200516835"|"--"|"200516835.01"|1|"Zari_2018_PMS"|"--"|"--"|"--"|"1.00"|"1.00"|"SP1, low priority for 2-3 PFS spectra, else try for TripleSpec (4.1, on the SOAR)."|"LCOGT 3 gp events pre 20190301 (2m)"|"SG1 (Allyson Bieryla, OIBEO 20200112 in ip and confirmed a 26 minute early ~ 45 ppt event in an uncontaminated 3.4"" target aperture with FWHM=2.1"".) Possible HJ around PMS star. Main worry is stellar-mass EB (and rotation period seems to be near the orbital period). Tdur is 1.9hour, gives correct stellar density. Depth is good."|"12.51"|"0.85"|"3.78"|"82.80"|"11.76"|"3.62"|"16.42"|"18.02"|"15.19"|"19.66"|"-1.00"|"13.47"|"12.82"|"12.51"|"15.11"|3266|"4.69"|"0.55"|"0.55"|"20191110_followup_comment_strings"|"2020-01-09 13:58:47.187601"|"2020-01-09 13:58:47.187633"|0|"PC"|"--"|"--"|"--"|"--"|"--"|"--"|"--"|"--"|"--"|"--"|"--"|"--"
"5290781443841554432"|"308538095"|"--"|"308538095.01"|1|"Kharchenko2013,CantatGaudin_2018,GaiaCollaboration2018_tab1b,Kounkel_2019"|"NGC_2516,NGC_2516,NGC2516,NGC_2516"|"8.48,8.4"|"1.0"|"0.00"|"2.00"|"SP2, was SP0 before Chiron recon showed SB2 and RV variable."|"LCOGT 3 gp >=4stage, pre 20190301"|"Retiring as SB2 in NGC 2516, presumably P=12d signal is F+M binary. CHIRON(4). 2 CHIRON epochs show clear SB2 signatures. LCOGT(2, 1 BEO i' good, 1 OIBE in g' with depth comparable to i'). 2 SG1 (Phil Evans, IBE, successful, Kevin Collins LCO 0.4m, total).  P~12 day WJ, NGC 2516. Multiple sector data available (S7,S8,S10)→ would benefit from multi-sector analysis. Gaia-DR2 RV in tension with Soubiran cluster RV, but at low significance -- higher precision RV requested. Otherwise nbhd analysis is good (plx, proper motion, positions all fine).  Ziegler got speckle AO, shows faint double-dot to NE/SW of the ACF at sep 1arcsec -- but Ziegler says is spurious (would be deltamag 4.). d=400pc.  Rstar=1.35, Teff=6150K (TICv8). SQ+GZ from CHIRON found T0308538095, 2019-12-17T06-44-23.0 2458834.79415 RV 18.833 0.034 Teff 6098 logg 4.36 feh 0.04 vsini 13.0. Note the vsini is an upper limit. This argues that the Gaia RV measurement was spurious. Whopping Li, EW=120mA (GZ, 20200122). Given this Teff, and 300Myr, one would expect Prot~4 days. CDIPS LCs have heavy systematics, no obvious Prot. Eleanor LCs hint at 6-7day rotation? Again though, not obvious. "|"28.86"|"11.73"|"11.69"|"120.85"|"-60.67"|"2.43"|"12.03"|"12.37"|"11.54"|"12.93"|"11.68"|"10.95"|"10.65"|"10.58"|"11.60"|6140|"4.24"|"1.35"|"1.16"|"20191110_followup_comment_strings"|"2020-01-09 13:58:47.550714"|"2020-01-09 13:58:47.550748"|1|"SB2,CM,FM_binary"|"--"|"--"|"--"|"--"|"--"|"--"|"--"|"--"|"--"|"--"|"--"|"--"
"5510676828723793920"|"59859387"|"--"|"59859387.01"|1|"CantatGaudin_2018,Kounkel_2019,Zari_2018_UMS,CantatGaudin_2018,Kounkel_2019,Zari_2018_UMS"|"Alessi_3,Alessi_3,--,Alessi_3,Alessi_3,--"|"8.87,8.8"|"0.0"|"0.00"|"0.00"|"SP0. (V=10.7). GO for PFS at ~10m/s precision (not 1m/s; vsini=27km/s from CHIRON).  Get 10 RVs at ~10-20m/s precision to determine if SB1.  Predicted K_planet=15-30m/s, P_orb=1.1d, K_spot=100m/s, P_rot=5d.  CHIRON shows (2020.0208) RV RMS < 1km/s. LGB queued 6 more in CHIRON slicer."|"--"|"Priority for RVs. Cand super neptune. LCOGT(2 ip, 2gp, both OIBEO and good), 1 CHAT (i-band), OIBE/IBEO. All reduced transits are good.  CHIRON(1 recon, GZ email 20191226 2019-12-18T05-41-37.9 2458835.74473 RV -1.586 0.202 Teff 6555 logg 4.09 feh -0.09 vsini 27.2). Gaia DR2 RV good enough to confirm cluster membership. But cluster membership and signal look v good -- this one is worth the effort! NB. sector 8 data are available. Nbhd reanalysis also v good. RVs solid enough. d=294pc. Rstar=1.5, Teff=6750K (lower from CHIRON Teff). Ziegler got speckle AO, rules out binary companion to ~0.2-0.3 arcsec. (Weakly detected) Prot=5d from CDIPS LC, amplitude 0.4%. 7 PFS RVs over 7 nights show linear trend of amplitude 500m/s. 1. There is a dT=4.7 star in the aperture, TIC767810561 = gaia 5510676828723794176. No TIC Rstar, but d=1.35kpc, vs 0.3kpc target. Bp-Rp=0.84. E(B-V) of 0.095. Gaia apsis quotes Teff 5200K. TIC8 Fig8 spline would give 5600K if dwarf.  RV RMS < 1km/s over 14 CHIRON RVs. 7 PFS RVs taken over 7 nights showed a linear trend (with hint of a turnover) with peak-to-peak amplitude 450m/s.  Doesn't obviously phase up with either the expected ~2.5 day rotation period (which is weak from photometry, but vsini strongly indicates it).  Also does not phase up with transit ephemeris, but this was expected.  This object needs a blend analysis for validation -- there is sufficient photometry now to do it (perhaps with one extra LCO g band light-curve to improve the SNR of chromaticity analysis). No further CHIRON observations necessary. PFS if possible (but them expensive). "|"5.98"|"0.41"|"1.12"|"110.37"|"-45.57"|"3.37"|"10.58"|"10.82"|"10.23"|"11.17"|"10.73"|"9.86"|"9.68"|"9.62"|"10.28"|6778|"4.26"|"1.47"|"1.45"|"20191110_followup_comment_strings"|"2020-01-09 13:58:47.924712"|"2020-01-09 13:58:47.924747"|0|"PC"|"spec"|"2.73"|"27.20"|"0.0010"|"27.20"|"1.73"|"0.72"|"20.00"|"9.61"|"27.02"|"0.35"|"37.68"
"5516140233292943872"|"238611475"|"--"|"238611475.01"|1|"Kounkel_2019,Zari_2018_PMS,CantatGaudin_2019_velaOB2,Kounkel_2019,Zari_2018_PMS,CantatGaudin_2019_velaOB2"|"Vela_OB2,N/A,cg19velaOB2_pop7,Vela_OB2,N/A,cg19velaOB2_pop7"|"7.08"|"--"|"1.00"|"1.00"|"SP1, would be nice to have PFS recon spectrum (desparately, for Rstar and Rp measurement). If good, 7 RVs with PFS could show planetary. Another possible triplespec proposal object. Instead of PFS though (b/c only 10 hrs), go for a 1800 sec CHIRON exposure. [And ideally, have other M dwarf references to compare with]"|"Wait until get recon spectrum before g’ or b’."|"CHAT (1, IBE). LCOGT (2, BEO, 2 OIBEO iband good). SG1 (Don Radford) 1 OIBEO (iband). V-shaped. Noisy star, 3% dip, PMS M dwarf. TESS data has at least s7+s9. Initially was just Zari+18 PMS, sector 9 boosted to CG19 VelaOB2 + Kounkel19 VelaOB2. CDIPS LCs exist for S7,S8,S9. 20200112: some b or g’-band totals might be nice, otherwise no more photometry needed. Need recon spectrum to determine Rstar better (or else use other method?), and thereby determine if possible planet, or not! (Rp is large). Note E(Bp-Rp)=1.37. 7 RVs could show planetary mass (e.g., HATS-71). TripleSpec4.1 recon spectrrum would be nice."|"49.31"|"14.79"|"1.54"|"122.33"|"-48.39"|"2.54"|"14.90"|"16.14"|"13.78"|"17.61"|"16.07"|"12.17"|"11.51"|"11.27"|"13.84"|3709|"-1.00"|"1.40"|"-1.00"|"20191110_followup_comment_strings"|"2020-01-09 13:58:48.312408"|"2020-01-09 13:58:48.312442"|0|"PC"|"--"|"--"|"--"|"--"|"--"|"--"|"--"|"--"|"--"|"--"|"--"|"--"
"5541111035713815552"|"134528212"|"--"|"134528212.01"|1|"Dias2014"|"NGC 2546"|"8.14"|"1.0"|"1.00"|"2.00"|"--"|"--"|"20191209: LGB retiring due to unconvincing neighborhood, + weakly suspect depth increase in new S8 data.  Suspect occ depth. Candidate HJ in NGC 2546 (~150 Myr).  TESS S7+S8 available. Astrometric excess indicates likely presence of wide binary companion. RVs to rule out stellar EB needed! Cluster membership looks passable (it's Dias). Nbhd analysis indicates target is maybe 2 sigma away from expected cluster PM dispersion. It is also weakly in the foreground (maybe 1.5-2 sigma). It would be on the periphery of the cluster -- the neighborhood is not convincing.  If it's 150 Myr, where is the rotation signal?  Needs RVs to check for Li.  Worth continuing observations, but difficult to confirm. Teff~=6000K from Gaia Bp-Rp color + TICv8 spline relation, and is flagged as dwarf (TICv8 did not report stellar params, probably b/c of ~1 arcsec companion, deltaMag=2 Gaia DR2 5541111035708733056)."|"15.57"|"7.13"|"1.61"|"122.41"|"-37.37"|"1.21"|"14.19"|"14.45"|"13.51"|"14.79"|"14.23"|"12.84"|"12.47"|"12.35"|"13.70"|-1|"-1.00"|"-1.00"|"-1.00"|"20191110_followup_comment_strings"|"2020-01-09 13:58:48.690075"|"2020-01-09 13:58:48.690136"|1|"PNEB,pNonCM"|"--"|"--"|"--"|"--"|"--"|"--"|"--"|"--"|"--"|"--"|"--"|"--"
